{
  "name": "MariaDB",
  "description": "MariaDB database server with user and database creation",
  "extends": "json:mariadb",
  "installation": [
    "create-db-dynamic-prices.json",
     "450-create-mariadb-user.json",
     "create-db-homeassistant.json",
    "450-create-mariadb-user.json"
  ]
}
