{
  "name": "oci-image",
  "description": "Base application for OCI image based services",
  "icon": "icon.png",
  "installation": [
    "011-get-oci-image.json",
    "100-create-configure-lxc.json",
    "200-start-lxc.json",
    "210-wait-for-container-ready.json",
    "305-set-pkg-mirror.json"
  ]
}


